{
  "summary": "Completed the first V5 live parallel pilot package. SpecBridge now has runtime-capability-status, three executor packets, three runtime launch plans, four live Claude Code execution artifacts, runtime-run/result/summary artifacts, autonomy metrics, docs, CLI coverage, and repository memory updates. Docs and tests live slices completed successfully. The CLI live slice failed twice and was remediated by the coordinator inside declared scope.",
  "changed_files": [
    ".specbridge/audit-packets/issue-076-v5-live-parallel-pilot.audit-packet.json",
    ".specbridge/audits/issue-076-v5-live-parallel-pilot.chatgpt-audit.json",
    ".specbridge/context/CURRENT_GOAL.md",
    ".specbridge/contracts/issue-076-v5-live-parallel-pilot.execution.md",
    ".specbridge/executor-handoffs/issue-076-v5-live-parallel-pilot.input.json",
    ".specbridge/executor-packets/issue-076-v5-live-parallel-pilot-cli-capability.executor-packet.json",
    ".specbridge/executor-packets/issue-076-v5-live-parallel-pilot-docs-capability.executor-packet.json",
    ".specbridge/executor-packets/issue-076-v5-live-parallel-pilot-tests-capability.executor-packet.json",
    ".specbridge/metrics/issue-076-v5-live-parallel-pilot.autonomy-metrics.json",
    ".specbridge/reports/issue-076-v5-live-parallel-pilot.final-report.json",
    ".specbridge/runtime-evidence/issue-076-cli-capability.executor-output.md",
    ".specbridge/runtime-evidence/issue-076-docs-capability.executor-output.md",
    ".specbridge/runtime-evidence/issue-076-tests-capability.executor-output.md",
    ".specbridge/runtime-executions/issue-076-cli-capability-retry-1.runtime-execution.json",
    ".specbridge/runtime-executions/issue-076-cli-capability.runtime-execution.json",
    ".specbridge/runtime-executions/issue-076-docs-capability.runtime-execution.json",
    ".specbridge/runtime-executions/issue-076-tests-capability.runtime-execution.json",
    ".specbridge/runtime-launches/issue-076-cli-capability.runtime-launch.json",
    ".specbridge/runtime-launches/issue-076-docs-capability.runtime-launch.json",
    ".specbridge/runtime-launches/issue-076-tests-capability.runtime-launch.json",
    ".specbridge/runtime-results/issue-076-cli-capability.runtime-result.json",
    ".specbridge/runtime-results/issue-076-docs-capability.runtime-result.json",
    ".specbridge/runtime-results/issue-076-tests-capability.runtime-result.json",
    ".specbridge/runtime-runs/issue-076-cli-capability.runtime-run.json",
    ".specbridge/runtime-runs/issue-076-docs-capability.runtime-run.json",
    ".specbridge/runtime-runs/issue-076-tests-capability.runtime-run.json",
    ".specbridge/runtime-summaries/issue-076-cli-capability.runtime-summary.json",
    ".specbridge/runtime-summaries/issue-076-docs-capability.runtime-summary.json",
    ".specbridge/runtime-summaries/issue-076-tests-capability.runtime-summary.json",
    ".specbridge/scopes/issue-076-v5-live-parallel-pilot.scope.json",
    "README.md",
    "docs/specbridge-runtime-capability-status.md",
    "docs/specbridge-test-results.md",
    "scripts/specbridge.ps1",
    "scripts/test-specbridge-cli.ps1"
  ],
  "validations": [
    "powershell -NoProfile -ExecutionPolicy Bypass -File ./scripts/specbridge.ps1 v5-pilot-status: passed",
    "powershell -NoProfile -ExecutionPolicy Bypass -File ./scripts/specbridge.ps1 runtime-capability-status: passed",
    "powershell -NoProfile -ExecutionPolicy Bypass -File ./scripts/validate-contracts.ps1: passed",
    "powershell -NoProfile -ExecutionPolicy Bypass -File ./scripts/validate-contract-scopes.ps1: passed",
    "powershell -NoProfile -ExecutionPolicy Bypass -File ./scripts/validate-executor-packets.ps1: passed",
    "powershell -NoProfile -ExecutionPolicy Bypass -File ./scripts/validate-runtime-launches.ps1: passed",
    "powershell -NoProfile -ExecutionPolicy Bypass -File ./scripts/validate-runtime-executions.ps1: passed",
    "powershell -NoProfile -ExecutionPolicy Bypass -File ./scripts/validate-runtime-runs.ps1: passed",
    "powershell -NoProfile -ExecutionPolicy Bypass -File ./scripts/validate-runtime-results.ps1: passed",
    "powershell -NoProfile -ExecutionPolicy Bypass -File ./scripts/validate-runtime-summaries.ps1: passed",
    "powershell -NoProfile -ExecutionPolicy Bypass -File ./scripts/validate-autonomy-metrics.ps1: passed",
    "powershell -NoProfile -ExecutionPolicy Bypass -File ./scripts/validate-final-reports.ps1: passed",
    "powershell -NoProfile -ExecutionPolicy Bypass -File ./scripts/validate-audit-packets.ps1: passed",
    "powershell -NoProfile -ExecutionPolicy Bypass -File ./scripts/validate-chatgpt-audits.ps1: passed",
    "powershell -NoProfile -ExecutionPolicy Bypass -File ./scripts/specbridge.ps1 validate -Profile standard: passed",
    "powershell -NoProfile -ExecutionPolicy Bypass -File ./scripts/test-specbridge-cli.ps1: passed",
    "powershell -NoProfile -ExecutionPolicy Bypass -File ./scripts/test-specbridge-negative-validations.ps1: passed",
    "powershell -NoProfile -ExecutionPolicy Bypass -File ./scripts/specbridge-smoke.ps1: passed",
    "powershell -NoProfile -ExecutionPolicy Bypass -File ./scripts/validate-security-gates.ps1: passed",
    "powershell -NoProfile -ExecutionPolicy Bypass -File ./scripts/validate-review-gate.ps1: passed",
    "GitHub CI: not_collected",
    "git diff --check: passed"
  ],
  "policy_result": "Passed with recorded autonomy exception. The task stayed inside the issue 076 execution contract and scope manifest. Live Claude Code was launched only through bounded execute-runtime-launch plans. Antigravity availability was verified as a local path check only. The CLI live executor failed twice, no further live retries were made, and coordinator remediation completed the scoped product change. No secrets, production configuration, billing, auth security, database changes, dependency installation, CI/CD security weakening, or deployment automation were involved.",
  "risk_result": "Medium risk. The live pilot proved parallel docs and tests executor slices, runtime evidence capture, summaries, metrics, and policy gates. Remaining risk is live CLI executor reliability because the implementation slice required coordinator remediation after two failed live attempts.",
  "unresolved_risks": [
    "GitHub PR CI evidence is pending until the branch is pushed and checks run.",
    "The CLI live executor failed twice with exit code 1 and no stderr; future work should improve live runner diagnostics, stdout capture policy, and prompt feedback before larger autonomous implementation pilots."
  ],
  "merge_status": "Pending pull request, GitHub CI, deterministic review gate, and required merge gates.",
  "deployment_status": "Not applicable.",
  "completion_status": "complete_pending_pr_ci"
}
