{
  "summary": "Completed issue 117 post-merge memory closure. Updated issue 115 final report, audit packet, and ChatGPT/Codex audit to record PR 116 merge and CI completion. Updated CURRENT_GOAL.md to close the issue 115 active phase and record issue 119 as the next recommended task. Updated README.md to mark the evidence loop as complete. Created issue 117 closure evidence artifact.",
  "changed_files": [
    "README.md",
    ".specbridge/audit-packets/issue-115-github-evidence-loop.audit-packet.json",
    ".specbridge/audit-packets/issue-117-post-merge-memory-closure.audit-packet.json",
    ".specbridge/audits/issue-115-github-evidence-loop.chatgpt-audit.json",
    ".specbridge/audits/issue-117-post-merge-memory-closure.chatgpt-audit.json",
    ".specbridge/context/CURRENT_GOAL.md",
    ".specbridge/contracts/issue-117-post-merge-memory-closure.execution.md",
    ".specbridge/github-evidence/issue-117-post-merge-memory-closure.closure.json",
    ".specbridge/reports/issue-115-github-evidence-loop.final-report.json",
    ".specbridge/reports/issue-117-post-merge-memory-closure.final-report.json",
    ".specbridge/scopes/issue-117-post-merge-memory-closure.scope.json"
  ],
  "validations": [
    "powershell -NoProfile -ExecutionPolicy Bypass -File ./scripts/validate-contracts.ps1: passed",
    "powershell -NoProfile -ExecutionPolicy Bypass -File ./scripts/validate-contract-scopes.ps1: passed",
    "powershell -NoProfile -ExecutionPolicy Bypass -File ./scripts/validate-final-reports.ps1: passed",
    "powershell -NoProfile -ExecutionPolicy Bypass -File ./scripts/validate-audit-packets.ps1: passed",
    "powershell -NoProfile -ExecutionPolicy Bypass -File ./scripts/validate-chatgpt-audits.ps1: passed",
    "powershell -NoProfile -ExecutionPolicy Bypass -File ./scripts/validate-security-gates.ps1: passed",
    "powershell -NoProfile -ExecutionPolicy Bypass -File ./scripts/validate-review-gate.ps1: passed",
    "git diff --check: passed",
    "GitHub CI: not_collected"
  ],
  "policy_result": "Passed. Memory and evidence updates only. No product code, scripts, workflows, secrets, production, billing, auth, authorization, database, dependency installation, CI/CD security, or deployment files changed.",
  "risk_result": "Low risk. This task only updates repository memory and evidence artifacts after a confirmed GitHub merge.",
  "unresolved_risks": [
    "GitHub CI and PR merge are pending for issue 117 branch."
  ],
  "merge_status": "PR pending. Issue 117 branch pushed; PR to be opened at https://github.com/yagooyarzabaldev-ops/specbridge.",
  "deployment_status": "Not applicable.",
  "completion_status": "complete_pending_pr_ci"
}
