{
  "summary": "Implemented a bounded local read-only MCP-style runtime for SpecBridge operator state. The new specbridge-mcp-runtime command supports resources/list and resources/read for current-goal, doctor-fix-plan, and orchestration summaries, rejects mutation-capable or unsupported methods with deterministic JSON errors, updates the MCP resource catalog and standard readiness surface to readonly_local_runtime, documents the runtime boundary, and reconciles stale PR #227 by closing it without merge as research-only backlog hygiene.",
  "changed_files": [
    ".specbridge/artifact-inventory/current.inventory.json",
    ".specbridge/audit-packets/issue-234-readonly-mcp-runtime.audit-packet.json",
    ".specbridge/audits/issue-234-readonly-mcp-runtime.chatgpt-audit.json",
    ".specbridge/context/CURRENT_GOAL.md",
    ".specbridge/contracts/issue-234-readonly-mcp-runtime.execution.md",
    ".specbridge/github-evidence/issue-234-readonly-mcp-runtime.closure.json",
    ".specbridge/github-evidence/issue-234-readonly-mcp-runtime.pr-227-reconciliation.json",
    ".specbridge/ledger/operations.ndjson",
    ".specbridge/mcp-resources/operator-state.catalog.json",
    ".specbridge/reports/issue-234-readonly-mcp-runtime.final-report.json",
    ".specbridge/scopes/issue-234-readonly-mcp-runtime.scope.json",
    ".specbridge/standard-readiness/current.status.json",
    ".specbridge/state/current-goal.json",
    "README.md",
    "docs/mcp-server-implementation-plan.md",
    "docs/specbridge-mcp-readonly-runtime.md",
    "docs/specbridge-mcp-resource-exports.md",
    "docs/specbridge-studio.html",
    "docs/status-dashboard.html",
    "scripts/lib/mcp-resources.ps1",
    "scripts/specbridge.ps1",
    "scripts/test-specbridge-cli.ps1"
  ],
  "validations": [
    "powershell -NoProfile -ExecutionPolicy Bypass -File ./scripts/validate-contracts.ps1: passed",
    "powershell -NoProfile -ExecutionPolicy Bypass -File ./scripts/validate-contract-scopes.ps1: passed",
    "powershell -NoProfile -ExecutionPolicy Bypass -File ./scripts/test-specbridge-cli.ps1: passed",
    "powershell -NoProfile -ExecutionPolicy Bypass -File ./scripts/validate-final-reports.ps1: passed",
    "powershell -NoProfile -ExecutionPolicy Bypass -File ./scripts/validate-audit-packets.ps1: passed",
    "powershell -NoProfile -ExecutionPolicy Bypass -File ./scripts/validate-chatgpt-audits.ps1: passed",
    "powershell -NoProfile -ExecutionPolicy Bypass -File ./scripts/specbridge-smoke.ps1: passed",
    "git diff --check: passed",
    "GitHub Actions Foundation Validation: passed",
    "GitHub Actions SpecBridge Review Gate: passed",
    "GitHub Actions SpecBridge PR Review Report: passed",
    "GitHub Actions Claude Review Non Blocking: passed",
    "manual specbridge-mcp-runtime resources/list: passed",
    "manual specbridge-mcp-runtime resources/read current-goal: passed",
    "manual specbridge-mcp-runtime tools/call rejection: passed"
  ],
  "policy_result": "Within policy. The runtime is local and read-only, exposes no mutation-capable MCP tools, does not start a network transport or hosted server, does not install dependencies, does not access secrets, does not touch production, billing, authentication, authorization, database, deployment, CI/CD security, branch cleanup enforcement, artifact retention enforcement, issue #194, or digital twin implementation. PR #227 was closed without merge and without branch deletion or cleanup enforcement.",
  "risk_result": "Medium risk and contained. The change adds a new CLI surface and updates readiness evidence, but the surface is restricted to deterministic resource listing and reading over existing repository-local operator resources.",
  "unresolved_risks": [
    "This is a local MCP-style harness, not a network MCP server transport.",
    "Mutation-capable MCP tools remain intentionally blocked.",
    "Branch cleanup and artifact retention debt remain observable but unenforced by policy."
  ],
  "merge_status": "PR #235 merged on 2026-06-21T21:01:16Z at merge commit 363091babcebdced9205f89b95d7745b88d8d940. Issue #234 closed automatically as completed and post-merge closure evidence was recorded.",
  "deployment_status": "Not applicable.",
  "completion_status": "complete"
}
