{
  "summary": "Closed SpecBridge phase 1 foundation status, completed the repository-first MVP operating runbook, and defined the essential V3 product scope while leaving runtime implementation and version 4 work explicitly future-scoped.",
  "changed_files": [
    "docs/specbridge-phase-completion.md",
    "docs/specbridge-mvp-operating-runbook.md",
    "docs/specbridge-v3-essential-product-scope.md",
    "specs/003-mvp-plan.md",
    "specs/004-acceptance-tests.md",
    ".specbridge/context/CURRENT_GOAL.md",
    ".specbridge/context/ACCEPTANCE_CRITERIA.md",
    ".specbridge/contracts/issue-042-finish-phases-1-3.execution.md",
    ".specbridge/reports/issue-042-finish-phases-1-3.final-report.json",
    "README.md"
  ],
  "validations": [
    "validate-foundation: PASSED",
    "validate-contracts: PASSED",
    "validate-schemas: PASSED",
    "validate-final-reports: PASSED",
    "validate-pr-review-reports: PASSED",
    "validate-claude-review-workflow: PASSED",
    "validate-autonomous-execution-protocol: PASSED",
    "validate-review-gate: PASSED",
    "specbridge-smoke: PASSED"
  ],
  "policy_result": "Passed. Changes are documentation and governance artifacts only. No secrets, production configuration, deployment automation, runtime product code, MCP server implementation, autonomous merge, or autonomous push to main were included.",
  "risk_result": "Low risk. Documentation and governance scope only. All required local validations passed.",
  "unresolved_risks": [
    "CI evidence requires push and pull request creation.",
    "V3 runtime implementation remains blocked until a dedicated execution contract authorizes source paths, runtime choice, tests, lint, typecheck, and build gates."
  ],
  "merge_status": "pending_pr",
  "deployment_status": "not_applicable",
  "completion_status": "complete_pending_pr"
}
