{
  "summary": "Added the first source-backed runtime summary slice. The CLI now supports summarize-runtime, which reads one declared runtime launch plan and one declared runtime result, verifies that they describe the same bounded executor chain, and writes one validated .specbridge/runtime-summaries/*.runtime-summary.json artifact with validation totals, policy result, merge readiness, blockers, and source files.",
  "changed_files": [
    ".specbridge/audits/issue-067-source-backed-runtime-slice.chatgpt-audit.json",
    ".specbridge/audit-packets/issue-067-source-backed-runtime-slice.audit-packet.json",
    ".specbridge/context/ACCEPTANCE_CRITERIA.md",
    ".specbridge/context/CURRENT_GOAL.md",
    ".specbridge/contracts/issue-067-source-backed-runtime-slice.execution.md",
    ".specbridge/reports/issue-067-source-backed-runtime-slice.final-report.json",
    ".specbridge/runtime-summaries/issue-067-source-backed-runtime-slice.runtime-summary.json",
    ".specbridge/scopes/issue-067-source-backed-runtime-slice.scope.json",
    "README.md",
    "docs/specbridge-autonomy-backlog.md",
    "docs/specbridge-local-cli.md",
    "docs/specbridge-runtime-launch-plans.md",
    "docs/specbridge-runtime-results.md",
    "docs/specbridge-runtime-summaries.md",
    "docs/specbridge-test-results.md",
    "scripts/specbridge-smoke.ps1",
    "scripts/specbridge.ps1",
    "scripts/test-specbridge-cli.ps1",
    "scripts/test-specbridge-negative-validations.ps1",
    "scripts/validate-runtime-summaries.ps1",
    "specs/004-acceptance-tests.md"
  ],
  "validations": [
    "powershell -NoProfile -ExecutionPolicy Bypass -File ./scripts/validate-runtime-summaries.ps1: passed",
    "powershell -NoProfile -ExecutionPolicy Bypass -File ./scripts/validate-runtime-results.ps1: passed",
    "powershell -NoProfile -ExecutionPolicy Bypass -File ./scripts/test-specbridge-cli.ps1: passed",
    "powershell -NoProfile -ExecutionPolicy Bypass -File ./scripts/test-specbridge-negative-validations.ps1: passed",
    "powershell -NoProfile -ExecutionPolicy Bypass -File ./scripts/validate-contracts.ps1: passed",
    "powershell -NoProfile -ExecutionPolicy Bypass -File ./scripts/validate-contract-scopes.ps1: passed",
    "powershell -NoProfile -ExecutionPolicy Bypass -File ./scripts/specbridge.ps1 validate -Profile standard: passed",
    "powershell -NoProfile -ExecutionPolicy Bypass -File ./scripts/specbridge-smoke.ps1: passed",
    "powershell -NoProfile -ExecutionPolicy Bypass -File ./scripts/validate-final-reports.ps1: passed",
    "powershell -NoProfile -ExecutionPolicy Bypass -File ./scripts/validate-audit-packets.ps1: passed",
    "powershell -NoProfile -ExecutionPolicy Bypass -File ./scripts/validate-chatgpt-audits.ps1: passed"
  ],
  "policy_result": "Passed. The task stayed inside the issue 067 contract and scope manifest. The new command reads one declared runtime launch plan and one declared runtime result, rejects mismatched launch/result chains, writes one declared runtime summary artifact, and records evidence-only execution policy booleans.",
  "risk_result": "Medium risk because runtime summaries may be used by later audit and merge gates. Risk is controlled by file-only evidence summarization, no live executor launch, no shell execution by the command, no dependency installation, no secrets, no production configuration, no authentication or authorization changes, no billing changes, no CI/CD weakening, and no deployment.",
  "unresolved_risks": [
    "GitHub PR CI evidence is pending until the branch is pushed and checks run.",
    "Runtime summaries link existing launch and result evidence; a future contract is still required for a fresh executor source run that creates new bounded executor output."
  ],
  "merge_status": "Pending pull request, GitHub CI, and required merge gates.",
  "deployment_status": "Not applicable.",
  "completion_status": "complete_pending_pr_ci"
}
