{
  "summary": "Added deterministic contract scope validation for SpecBridge multi-agent coordination.",
  "changed_files": [
    "scripts/validate-contract-scopes.ps1",
    "scripts/test-specbridge-negative-validations.ps1",
    "scripts/specbridge-smoke.ps1",
    "docs/specbridge-contract-scope-validator.md",
    "docs/specbridge-test-matrix.md",
    "docs/specbridge-test-results.md",
    "docs/specbridge-autonomy-backlog.md",
    "specs/004-acceptance-tests.md",
    ".specbridge/context/CURRENT_GOAL.md",
    ".specbridge/context/ACCEPTANCE_CRITERIA.md",
    ".specbridge/scopes/issue-048-contract-scope-validator.scope.json",
    ".specbridge/contracts/issue-048-contract-scope-validator.execution.md",
    ".specbridge/reports/issue-048-contract-scope-validator.final-report.json"
  ],
  "validations": [
    "powershell -ExecutionPolicy Bypass -File ./scripts/validate-foundation.ps1: passed",
    "powershell -ExecutionPolicy Bypass -File ./scripts/validate-contracts.ps1: passed",
    "powershell -ExecutionPolicy Bypass -File ./scripts/validate-contract-scopes.ps1: passed",
    "powershell -ExecutionPolicy Bypass -File ./scripts/validate-schemas.ps1: passed",
    "powershell -ExecutionPolicy Bypass -File ./scripts/validate-final-reports.ps1: passed",
    "powershell -ExecutionPolicy Bypass -File ./scripts/validate-pr-review-reports.ps1: passed",
    "powershell -ExecutionPolicy Bypass -File ./scripts/validate-claude-review-workflow.ps1: passed",
    "powershell -ExecutionPolicy Bypass -File ./scripts/validate-autonomous-execution-protocol.ps1: passed",
    "powershell -ExecutionPolicy Bypass -File ./scripts/validate-review-gate.ps1: passed",
    "powershell -ExecutionPolicy Bypass -File ./scripts/test-specbridge-negative-validations.ps1: passed",
    "powershell -ExecutionPolicy Bypass -File ./scripts/specbridge-smoke.ps1: passed",
    "git diff --check: passed"
  ],
  "policy_result": "Passed. Scope is limited to governance scripts, tests, documentation, context, contract, scope manifest, and final report artifacts.",
  "risk_result": "Low risk. No runtime product code, secrets, production configuration, billing, authentication, authorization, CI/CD security weakening, or deployment automation.",
  "unresolved_risks": [
    "CI evidence is pending until the branch is pushed and GitHub checks run."
  ],
  "merge_status": "Pending pull request and required gates.",
  "deployment_status": "Not applicable.",
  "completion_status": "complete_pending_ci"
}
