{
  "summary": "Agent A produced the implementation-slice evidence artifact for the multi-agent pilot.",
  "changed_files": [
    ".specbridge/pilot/multi-agent/agent-a-implementation-output.md",
    ".specbridge/reports/issue-054-agent-a-implementation-slice.final-report.json"
  ],
  "validations": [
    "powershell -ExecutionPolicy Bypass -File ./scripts/test-specbridge-multi-agent-pilot.ps1: passed",
    "powershell -ExecutionPolicy Bypass -File ./scripts/validate-contract-scopes.ps1: passed"
  ],
  "policy_result": "Passed. Agent A stayed inside its implementation-slice evidence path and final report path.",
  "risk_result": "Low risk documentation artifact only. No secrets, production configuration, billing, authentication, authorization, CI/CD security, dependencies, network calls, or deployment.",
  "unresolved_risks": [],
  "merge_status": "Coordinator integration PR controls merge.",
  "deployment_status": "Not applicable.",
  "completion_status": "complete_pending_coordinator"
}
