{
  "summary": "Completed the second V5 live autonomy pilot evidence chain. The repository now has a deterministic v5-autonomy-status CLI command, CLI test coverage, documentation aligned to the implemented output, three live Claude Code product slices, runtime launch and execution evidence, runtime-run/result/summary artifacts, and autonomy metrics showing three ready slices and zero blocked slices. Product changes were authored by live executors; coordinator work was limited to contract, scope, runtime configuration, validation, evidence recording, and audit artifacts.",
  "changed_files": [
    ".specbridge/audit-packets/issue-080-second-v5-live-autonomy-pilot.audit-packet.json",
    ".specbridge/audits/issue-080-second-v5-live-autonomy-pilot.chatgpt-audit.json",
    ".specbridge/context/CURRENT_GOAL.md",
    ".specbridge/contracts/issue-080-second-v5-live-autonomy-pilot.execution.md",
    ".specbridge/executor-handoffs/issue-080-second-v5-live-autonomy-pilot.input.json",
    ".specbridge/executor-packets/issue-080-second-v5-live-autonomy-pilot-docs.executor-packet.json",
    ".specbridge/executor-packets/issue-080-second-v5-live-autonomy-pilot-implementation.executor-packet.json",
    ".specbridge/executor-packets/issue-080-second-v5-live-autonomy-pilot-tests.executor-packet.json",
    ".specbridge/metrics/issue-080-second-v5-live-autonomy-pilot.autonomy-metrics.json",
    ".specbridge/reports/issue-080-second-v5-live-autonomy-pilot.final-report.json",
    ".specbridge/runtime-evidence/issue-080-docs.executor-output.md",
    ".specbridge/runtime-evidence/issue-080-implementation.executor-output.md",
    ".specbridge/runtime-evidence/issue-080-tests.executor-output.md",
    ".specbridge/runtime-executions/issue-080-docs.runtime-execution.json",
    ".specbridge/runtime-executions/issue-080-docs-retry-1.runtime-execution.json",
    ".specbridge/runtime-executions/issue-080-implementation-retry-1.runtime-execution.json",
    ".specbridge/runtime-executions/issue-080-tests-retry-1.runtime-execution.json",
    ".specbridge/runtime-launches/issue-080-docs.runtime-launch.json",
    ".specbridge/runtime-launches/issue-080-implementation.runtime-launch.json",
    ".specbridge/runtime-launches/issue-080-tests.runtime-launch.json",
    ".specbridge/runtime-results/issue-080-docs.runtime-result.json",
    ".specbridge/runtime-results/issue-080-implementation.runtime-result.json",
    ".specbridge/runtime-results/issue-080-tests.runtime-result.json",
    ".specbridge/runtime-runs/issue-080-docs.runtime-run.json",
    ".specbridge/runtime-runs/issue-080-implementation.runtime-run.json",
    ".specbridge/runtime-runs/issue-080-tests.runtime-run.json",
    ".specbridge/runtime-summaries/issue-080-docs.runtime-summary.json",
    ".specbridge/runtime-summaries/issue-080-implementation.runtime-summary.json",
    ".specbridge/runtime-summaries/issue-080-tests.runtime-summary.json",
    ".specbridge/scopes/issue-078-v5-live-status-diagnostics.scope.json",
    ".specbridge/scopes/issue-080-second-v5-live-autonomy-pilot.scope.json",
    "README.md",
    "docs/specbridge-v5-autonomy-status.md",
    "scripts/specbridge.ps1",
    "scripts/test-specbridge-cli.ps1"
  ],
  "validations": [
    "powershell -NoProfile -ExecutionPolicy Bypass -File ./scripts/specbridge.ps1 runtime-capability-status: passed",
    "powershell -NoProfile -ExecutionPolicy Bypass -File ./scripts/specbridge.ps1 v5-live-status: passed",
    "powershell -NoProfile -ExecutionPolicy Bypass -File ./scripts/specbridge.ps1 v5-autonomy-status: passed",
    "powershell -NoProfile -ExecutionPolicy Bypass -File ./scripts/validate-contracts.ps1: passed",
    "powershell -NoProfile -ExecutionPolicy Bypass -File ./scripts/validate-contract-scopes.ps1: passed",
    "powershell -NoProfile -ExecutionPolicy Bypass -File ./scripts/validate-executor-packets.ps1: passed",
    "powershell -NoProfile -ExecutionPolicy Bypass -File ./scripts/validate-runtime-launches.ps1: passed",
    "powershell -NoProfile -ExecutionPolicy Bypass -File ./scripts/validate-runtime-executions.ps1: passed",
    "powershell -NoProfile -ExecutionPolicy Bypass -File ./scripts/validate-runtime-runs.ps1: passed",
    "powershell -NoProfile -ExecutionPolicy Bypass -File ./scripts/validate-runtime-results.ps1: passed",
    "powershell -NoProfile -ExecutionPolicy Bypass -File ./scripts/validate-runtime-summaries.ps1: passed",
    "powershell -NoProfile -ExecutionPolicy Bypass -File ./scripts/validate-autonomy-metrics.ps1: passed",
    "powershell -NoProfile -ExecutionPolicy Bypass -File ./scripts/validate-final-reports.ps1: passed",
    "powershell -NoProfile -ExecutionPolicy Bypass -File ./scripts/validate-audit-packets.ps1: passed",
    "powershell -NoProfile -ExecutionPolicy Bypass -File ./scripts/validate-chatgpt-audits.ps1: passed",
    "powershell -NoProfile -ExecutionPolicy Bypass -File ./scripts/specbridge.ps1 validate -Profile standard: passed",
    "powershell -NoProfile -ExecutionPolicy Bypass -File ./scripts/test-specbridge-cli.ps1: passed",
    "powershell -NoProfile -ExecutionPolicy Bypass -File ./scripts/test-specbridge-negative-validations.ps1: passed",
    "powershell -NoProfile -ExecutionPolicy Bypass -File ./scripts/specbridge-smoke.ps1: passed",
    "powershell -NoProfile -ExecutionPolicy Bypass -File ./scripts/validate-security-gates.ps1: passed",
    "powershell -NoProfile -ExecutionPolicy Bypass -File ./scripts/validate-review-gate.ps1: passed",
    "git diff --check: passed",
    "GitHub CI: not_collected"
  ],
  "policy_result": "Passed locally. The task stayed inside the issue 080 execution contract and scope manifest. Live product slices used bounded Claude Code launch plans with declared write scopes. The coordinator did not author product remediation in scripts/specbridge.ps1, scripts/test-specbridge-cli.ps1, README.md, or docs/specbridge-v5-autonomy-status.md after live execution started. The only coordinator artifact correction was a runtime execution diagnostic preview normalization for schema validation; it did not change exit code, status, stdout hash, stderr hash, product files, or validation outcomes.",
  "risk_result": "Medium risk. This task used live Claude Code execution and modified local CLI behavior, tests, documentation, and runtime evidence. No secrets, production configuration, billing, authentication, authorization, database, dependency installation, CI/CD security change, or deployment automation were involved. Remaining external risk is GitHub CI and merge gate completion.",
  "unresolved_risks": [
    "GitHub PR CI evidence is pending until the branch is pushed and checks run.",
    "The first implementation attempt failed only because max_budget_usd 0.25 was too low; it produced no product changes and the one allowed live retry succeeded.",
    "The tests runtime execution required one live retry because the first successful runtime artifact had an invalid multibyte diagnostic preview.",
    "The docs runtime execution required one live retry to align documented example values with the implemented CLI output."
  ],
  "merge_status": "Pending pull request, GitHub CI, deterministic review gate, and required merge gates.",
  "deployment_status": "Not applicable.",
  "completion_status": "complete_pending_pr_ci"
}
