{
  "summary": "Completed the bounded SpecBridge v2 release-readiness hardening phase for issue #260. Claude Code ran first and produced the main v2 implementation with 231 local tests passing. Codex reviewed the result, found and fixed a weak unicode-escaped-property test fixture, removed destructive reset guidance from rollback docs, aligned the v2 contract, reran validations, committed, pushed, and verified GitHub Actions CI. The v2 commit 1c1def8aa349fa896100bc395702b764c1ede355 was pushed to origin/master and CI run 28145621712 passed.",
  "changed_files": [
    ".specbridge/contracts/issue-260-specbridge-v2-release-readiness-hardening.execution.md",
    ".specbridge/scopes/issue-260-specbridge-v2-release-readiness-hardening.scope.json",
    ".specbridge/github-evidence/issue-260-specbridge-v2-release-readiness-hardening.issue.json",
    ".specbridge/github-evidence/issue-260-specbridge-v2-release-readiness-hardening.repo.json",
    ".specbridge/github-evidence/issue-260-specbridge-v2-release-readiness-hardening.ci.json",
    ".specbridge/runtime-evidence/issue-260-specbridge-v2-claude-output.md",
    ".specbridge/reports/issue-260-specbridge-v2-release-readiness-hardening.final-report.json",
    ".specbridge/audit-packets/issue-260-specbridge-v2-release-readiness-hardening.audit-packet.json",
    ".specbridge/audits/issue-260-specbridge-v2-release-readiness-hardening.chatgpt-audit.json"
  ],
  "validations": [
    "SpecBridge v1 powershell -NoProfile -ExecutionPolicy Bypass -File ./scripts/validate-contracts.ps1: passed before v2 mutation",
    "SpecBridge v1 powershell -NoProfile -ExecutionPolicy Bypass -File ./scripts/validate-contract-scopes.ps1: passed before v2 mutation",
    "SpecBridge v2 Claude Code invocation completed and reported 231 passed, 0 failed",
    "SpecBridge v2 Codex review found weak T27 unicode-escape fixture and corrected it",
    "SpecBridge v2 powershell -NoProfile -ExecutionPolicy Bypass -File .\\scripts\\test.ps1: passed with 231 passed, 0 failed",
    "SpecBridge v2 git diff --check: passed",
    "SpecBridge v2 touched-file encoding scan: passed, all checked files ASCII-only with no UTF-8 BOM",
    "SpecBridge v2 git commit: 1c1def8aa349fa896100bc395702b764c1ede355 Harden release readiness",
    "SpecBridge v2 git push origin master: passed, 1751971..1c1def8",
    "SpecBridge v2 gh run watch 28145621712: passed",
    "SpecBridge v2 gh run view 28145621712: CI completed successfully on 1c1def8aa349fa896100bc395702b764c1ede355",
    "SpecBridge v1 git diff --check: passed before final evidence validation"
  ],
  "policy_result": "Within the dedicated issue #260 contract. The work did not access secrets, install dependencies, change production configuration, billing, authentication, authorization, databases, deployment automation, hosted runtimes, external AI providers, mutation-capable MCP tools, repository visibility, CI workflow security, force push, branch deletion, or remote deletion. The only remote mutation after local validation was the authorized normal non-force push to specbridge-v2 origin/master and GitHub CI/status reads.",
  "risk_result": "Medium-risk static-validator hardening was bounded to declared v2 files and additive tests/docs/evidence. The validator now handles unicode-escaped JSON property names in array-field syntax checks, rejects rooted or parent-traversal forbidden_paths entries, and rejects operation names with surrounding whitespace while preserving existing exit codes and report fields.",
  "unresolved_risks": [
    "The v1 evidence branch is not merged into main.",
    "specbridge-v2 master remains unprotected because branch protection is blocked by the previously recorded GitHub plan/private visibility limitation.",
    "Runtime operation enforcement remains future scope; v2 validates manifests but does not execute or sandbox operations.",
    "CI still uses actions/checkout@v4 rather than a SHA-pinned action because CI workflow hardening is blocked without a dedicated CI workflow contract."
  ],
  "merge_status": "v2 master updated by normal non-force push. No autonomous merge into v1 main was performed; v1 evidence remains on branch codex/issue-255-serious-product-build-pilot and requires PR, CI, review, and explicit operator merge authority.",
  "deployment_status": "Not applicable. No deployment was requested or performed.",
  "completion_status": "completed"
}
