{
  "summary": "Completed issue 121 post-merge memory closure. PR 120 merged issue 119 apply-mode pilot on 2026-06-06 with CI passed. Updated evidence file with github_ci_passed true. Executed apply-mode issue_close confirming goal state achieved. Fixed ErrorActionPreference Stop bug in specbridge.ps1 that caused NativeCommandError on gh stderr. Marked issue 119 scope as completed. Created all issue 121 artifacts. Updated CURRENT_GOAL.md for issue 123 and README.md.",
  "changed_files": [
    "README.md",
    ".specbridge/context/CURRENT_GOAL.md",
    ".specbridge/contracts/issue-121-post-merge-closure-issue119.execution.md",
    ".specbridge/scopes/issue-121-post-merge-closure-issue119.scope.json",
    ".specbridge/scopes/issue-119-apply-mode-github-operator-pilot.scope.json",
    ".specbridge/reports/issue-121-post-merge-closure-issue119.final-report.json",
    ".specbridge/audit-packets/issue-121-post-merge-closure-issue119.audit-packet.json",
    ".specbridge/audits/issue-121-post-merge-closure-issue119.chatgpt-audit.json",
    ".specbridge/github-evidence/issue-119-apply-mode-github-operator-pilot.github-mutation-evidence.json",
    ".specbridge/github-evidence/issue-121-post-merge-closure-issue119.closure.json",
    "scripts/specbridge.ps1"
  ],
  "validations": [
    "powershell -NoProfile -ExecutionPolicy Bypass -File ./scripts/validate-contracts.ps1: passed",
    "powershell -NoProfile -ExecutionPolicy Bypass -File ./scripts/validate-contract-scopes.ps1: passed",
    "powershell -NoProfile -ExecutionPolicy Bypass -File ./scripts/validate-final-reports.ps1: passed",
    "powershell -NoProfile -ExecutionPolicy Bypass -File ./scripts/validate-audit-packets.ps1: passed",
    "powershell -NoProfile -ExecutionPolicy Bypass -File ./scripts/validate-chatgpt-audits.ps1: passed",
    "powershell -NoProfile -ExecutionPolicy Bypass -File ./scripts/validate-security-gates.ps1: passed",
    "powershell -NoProfile -ExecutionPolicy Bypass -File ./scripts/validate-review-gate.ps1: passed",
    "git diff --check: passed",
    "GitHub CI: not_collected"
  ],
  "policy_result": "Passed. Memory, evidence, and minimal bug fix. No logic changes outside gh error handling. No secrets, production, billing, auth, database, dependency installation, CI/CD security, or deployment files changed.",
  "risk_result": "Low risk. Evidence file update, scope completion, memory closure, and single-line ErrorActionPreference guard for gh stderr.",
  "unresolved_risks": [
    "GitHub CI and PR merge pending for issue 121 branch."
  ],
  "merge_status": "PR pending. Issue 121 branch pushed; PR to be opened at https://github.com/yagooyarzabaldev-ops/specbridge.",
  "deployment_status": "Not applicable.",
  "completion_status": "complete_pending_pr_ci"
}
