{
  "summary": "Implemented issue #246 by adopting lightweight Claude Agent SDK loop practices that fit the current SpecBridge runtime. Bounded local MCP tools now advertise annotations.readOnlyHint true, the CLI regression suite fails if an allowlisted bounded tool misses that metadata, CLAUDE.md now preserves governed task evidence during compaction, and token/context plus MCP documentation record the adopted practices and blocked future SDK runtime boundaries.",
  "changed_files": [
    ".specbridge/artifact-inventory/current.inventory.json",
    ".specbridge/audit-packets/issue-246-agent-sdk-light-practices.audit-packet.json",
    ".specbridge/audits/issue-246-agent-sdk-light-practices.chatgpt-audit.json",
    ".specbridge/context/CURRENT_GOAL.md",
    ".specbridge/contracts/issue-246-agent-sdk-light-practices.execution.md",
    ".specbridge/github-evidence/issue-246-agent-sdk-light-practices.closure.json",
    ".specbridge/ledger/operations.ndjson",
    ".specbridge/mcp-resources/operator-state.catalog.json",
    ".specbridge/reports/issue-246-agent-sdk-light-practices.final-report.json",
    ".specbridge/scopes/issue-246-agent-sdk-light-practices.scope.json",
    ".specbridge/standard-readiness/current.status.json",
    ".specbridge/state/current-goal.json",
    "CLAUDE.md",
    "README.md",
    "docs/specbridge-mcp-bounded-tools.md",
    "docs/specbridge-studio.html",
    "docs/specbridge-token-context-governance.md",
    "docs/status-dashboard.html",
    "scripts/lib/mcp-tools.ps1",
    "scripts/test-specbridge-cli.ps1"
  ],
  "validations": [
    "powershell -NoProfile -ExecutionPolicy Bypass -File ./scripts/validate-contracts.ps1: passed",
    "powershell -NoProfile -ExecutionPolicy Bypass -File ./scripts/validate-contract-scopes.ps1: passed",
    "powershell -NoProfile -ExecutionPolicy Bypass -File ./scripts/test-specbridge-cli.ps1: passed",
    "powershell -NoProfile -ExecutionPolicy Bypass -File ./scripts/validate-final-reports.ps1: passed",
    "powershell -NoProfile -ExecutionPolicy Bypass -File ./scripts/validate-audit-packets.ps1: passed",
    "powershell -NoProfile -ExecutionPolicy Bypass -File ./scripts/validate-chatgpt-audits.ps1: passed",
    "powershell -NoProfile -ExecutionPolicy Bypass -File ./scripts/specbridge-smoke.ps1: passed",
    "git diff --check: passed",
    "claude -p issue-246 bounded implementation audit: passed",
    "GitHub Actions Foundation Validation: passed",
    "GitHub Actions SpecBridge Review Gate: passed",
    "GitHub Actions SpecBridge PR Review Report: passed",
    "GitHub Actions Claude Review Non Blocking: passed"
  ],
  "policy_result": "Within policy. The implementation only adds local read-only MCP metadata, regression coverage, and documentation. It does not install dependencies, import or host the Agent SDK, implement hooks, persist SDK sessions, add network MCP transport, add mutation-capable MCP tools, mutate GitHub through MCP, access secrets, configure billing, change production, implement auth, change databases, change CI/CD security, enforce cleanup, or deploy.",
  "risk_result": "Low risk and contained. The change narrows ambiguity around existing read-only tools and context preservation without expanding runtime authority.",
  "unresolved_risks": [
    "Hosted Agent SDK runtime, hooks, session resume or fork, structured output retries, telemetry, network MCP transport, and mutation-capable tools remain blocked future work requiring dedicated contracts."
  ],
  "merge_status": "PR #247 merged on 2026-06-22T22:33:30Z at merge commit f7dbdc520dbd68d779b2ec6b9ff9ddd0271788da. Issue #246 closed automatically as completed and post-merge closure evidence was recorded.",
  "deployment_status": "Not applicable. No deployment is allowed by this contract.",
  "completion_status": "complete"
}
